{
  "schemaVersion": 1,
  "generatedAt": "2026-08-05T06:18:54+00:00",
  "verificationStatus": "DEMO_NON_CONFIRMATORY",
  "coordinateSystem": {
    "frame": "ENU",
    "distanceUnit": "m",
    "timeUnit": "ms"
  },
  "defaultScenarioId": "open-blocks",
  "planners": [
    {
      "id": "astar-3d",
      "label": "3D A*"
    },
    {
      "id": "lazy-theta-star",
      "label": "Lazy Theta*"
    },
    {
      "id": "rrt-star",
      "label": "RRT*"
    }
  ],
  "scenarios": [
    {
      "id": "open-blocks",
      "label": "Open blocks",
      "description": "Irregular open city blocks.",
      "scenarioSeed": null,
      "fingerprint": "sha256:cd060091183221f321333a534eb2c9f42957ad18162f9d0d9f781e9696f86db5",
      "bounds": {
        "min": [
          0,
          0,
          0
        ],
        "max": [
          100,
          100,
          55
        ]
      },
      "start": [
        6,
        7,
        6
      ],
      "goal": [
        94,
        92,
        8
      ],
      "constraints": {
        "vehicleRadiusM": 1.0,
        "safetyMarginM": 1.0,
        "maxAltitudeM": 55
      },
      "buildings": [
        {
          "id": "b01",
          "min": [
            18,
            12,
            0.0
          ],
          "max": [
            32,
            30,
            20
          ]
        },
        {
          "id": "b02",
          "min": [
            18,
            42,
            0.0
          ],
          "max": [
            32,
            59,
            32
          ]
        },
        {
          "id": "b03",
          "min": [
            18,
            72,
            0.0
          ],
          "max": [
            32,
            88,
            25
          ]
        },
        {
          "id": "b04",
          "min": [
            44,
            18,
            0.0
          ],
          "max": [
            59,
            35,
            35
          ]
        },
        {
          "id": "b05",
          "min": [
            44,
            50,
            0.0
          ],
          "max": [
            59,
            68,
            22
          ]
        },
        {
          "id": "b06",
          "min": [
            70,
            10,
            0.0
          ],
          "max": [
            86,
            30,
            28
          ]
        },
        {
          "id": "b07",
          "min": [
            70,
            43,
            0.0
          ],
          "max": [
            86,
            59,
            38
          ]
        },
        {
          "id": "b08",
          "min": [
            70,
            72,
            0.0
          ],
          "max": [
            86,
            89,
            24
          ]
        }
      ],
      "noFlyZones": [],
      "results": [
        {
          "plannerId": "astar-3d",
          "runId": "open-blocks:astar-3d:seed-None",
          "plannerSeed": null,
          "status": "success",
          "failureReason": null,
          "budget": {
            "maxIterations": 120000
          },
          "searchEffort": {
            "kind": "expanded-nodes",
            "value": 1921
          },
          "paths": {
            "raw": [
              [
                6,
                7,
                6
              ],
              [
                8.0,
                8.0,
                12.0
              ],
              [
                12.0,
                12.0,
                16.0
              ],
              [
                12.0,
                16.0,
                20.0
              ],
              [
                16.0,
                20.0,
                24.0
              ],
              [
                20.0,
                24.0,
                24.0
              ],
              [
                24.0,
                28.0,
                24.0
              ],
              [
                28.0,
                32.0,
                24.0
              ],
              [
                32.0,
                36.0,
                24.0
              ],
              [
                36.0,
                40.0,
                24.0
              ],
              [
                40.0,
                44.0,
                24.0
              ],
              [
                44.0,
                48.0,
                28.0
              ],
              [
                48.0,
                52.0,
                28.0
              ],
              [
                52.0,
                56.0,
                28.0
              ],
              [
                56.0,
                60.0,
                28.0
              ],
              [
                60.0,
                64.0,
                28.0
              ],
              [
                64.0,
                68.0,
                28.0
              ],
              [
                68.0,
                72.0,
                28.0
              ],
              [
                72.0,
                76.0,
                28.0
              ],
              [
                76.0,
                80.0,
                28.0
              ],
              [
                80.0,
                80.0,
                28.0
              ],
              [
                84.0,
                80.0,
                28.0
              ],
              [
                88.0,
                80.0,
                28.0
              ],
              [
                92.0,
                84.0,
                24.0
              ],
              [
                92.0,
                88.0,
                20.0
              ],
              [
                92.0,
                88.0,
                16.0
              ],
              [
                92.0,
                88.0,
                12.0
              ],
              [
                94,
                92,
                8
              ]
            ],
            "smoothed": [
              [
                6,
                7,
                6
              ],
              [
                6.587004060131617,
                7.761996708408746,
                7.052457945356024
              ],
              [
                7.178040428179839,
                8.527051588562644,
                8.10397814468493
              ],
              [
                7.773019528404765,
                9.295098158467233,
                9.154553599882039
              ],
              [
                8.371851785066488,
                10.066069936128057,
                10.204177312842669
              ],
              [
                8.974447622425105,
                10.839900439550654,
                11.252842285462142
              ],
              [
                9.580717464740715,
                11.616523186740563,
                12.300541519635779
              ],
              [
                10.190571736273409,
                12.395871695703327,
                13.347268017258896
              ],
              [
                10.80392086128329,
                13.177879484444482,
                14.39301478022682
              ],
              [
                11.420675264030447,
                13.962480070969573,
                15.437774810434862
              ],
              [
                12.040745368774981,
                14.749606973284134,
                16.481541109778345
              ],
              [
                12.66404159977699,
                15.539193709393711,
                17.5243066801526
              ],
              [
                13.290474381296562,
                16.331173797303844,
                18.566064523452926
              ],
              [
                13.9199541375938,
                17.125480755020067,
                19.60680764157466
              ],
              [
                14.5523912929288,
                17.92204810054793,
                20.646529036413114
              ],
              [
                15.187696271561657,
                18.720809351892964,
                21.685221709863615
              ],
              [
                15.825779497752466,
                19.521698027060708,
                22.722878663821476
              ],
              [
                16.82063698522927,
                20.42957810682893,
                23.068399671815516
              ],
              [
                17.944916340778637,
                21.377035571439066,
                23.165342226607383
              ],
              [
                19.071705216666246,
                22.326421013888538,
                23.26122806759257
              ],
              [
                20.20091403715219,
                23.277667952182885,
                23.3560501966664
              ],
              [
                21.33245322649657,
                24.23070990432764,
                23.44980161572419
              ],
              [
                22.46623320895948,
                25.18548038832836,
                23.542475326661265
              ],
              [
                23.602164408801016,
                26.141912922190578,
                23.63406433137294
              ],
              [
                24.74015725028128,
                27.099941023919822,
                23.724561631754543
              ],
              [
                25.880122157660356,
                28.05949821152165,
                23.813960229701387
              ],
              [
                27.02196955519835,
                29.020518003001587,
                23.90225312710879
              ],
              [
                28.16560986715535,
                29.982933916365184,
                23.989433325872078
              ],
              [
                29.310953517791464,
                30.94667946961798,
                24.075493827886568
              ],
              [